{
  "$schema": "./design-tokens.schema.json",
  "meta": {
    "name": "MM Design System Tokens",
    "version": "2.0.0",
    "updated": "2024-11-20",
    "description": "Canonical definition for the MM design system tokens. All generated CSS/TS artifacts are derived from this file."
  },
  "brand": {
    "primary": {
      "cssVar": "--color-mm-primary",
      "value": "#337def",
      "description": "Primary brand blue used for CTAs and key highlights."
    },
    "secondary": {
      "cssVar": "--color-mm-secondary",
      "value": "#fcc729",
      "description": "Secondary accent yellow used for supporting highlights."
    },
    "dark": {
      "cssVar": "--color-mm-dark",
      "value": "#1f1f1f",
      "description": "Primary dark background."
    },
    "dark2": {
      "cssVar": "--color-mm-dark2",
      "value": "#2a2a2a",
      "description": "Dark background variant for layers."
    },
    "white": {
      "cssVar": "--color-mm-white",
      "value": "#ffffff",
      "description": "Pure white for text and backgrounds."
    },
    "gray": {
      "cssVar": "--color-mm-gray",
      "value": "#ababab",
      "description": "Neutral gray for borders and text."
    }
  },
  "semantic": {
    "background": {
      "cssVar": "--background",
      "format": "hsl-channel",
      "aliases": [
        { "name": "--color-background", "format": "hsl" }
      ],
      "values": {
        "light": "0 0% 100%",
        "dark": "0 0% 12%"
      },
      "description": "Base page background."
    },
    "foreground": {
      "cssVar": "--foreground",
      "format": "hsl-channel",
      "aliases": [
        { "name": "--color-foreground", "format": "hsl" }
      ],
      "values": {
        "light": "0 0% 3.9%",
        "dark": "0 0% 100%"
      },
      "description": "Primary text color."
    },
    "card": {
      "cssVar": "--card",
      "format": "hsl-channel",
      "aliases": [
        { "name": "--color-card", "format": "hsl" }
      ],
      "values": {
        "light": "0 0% 100%",
        "dark": "0 0% 16%"
      },
      "description": "Card and surface backgrounds."
    },
    "cardForeground": {
      "cssVar": "--card-foreground",
      "format": "hsl-channel",
      "aliases": [
        { "name": "--color-card-foreground", "format": "hsl" }
      ],
      "values": {
        "light": "0 0% 3.9%",
        "dark": "0 0% 100%"
      },
      "description": "Text on card surfaces."
    },
    "popover": {
      "cssVar": "--popover",
      "format": "hsl-channel",
      "aliases": [
        { "name": "--color-popover", "format": "hsl" }
      ],
      "values": {
        "light": "0 0% 100%",
        "dark": "0 0% 16%"
      },
      "description": "Popover and tooltip background."
    },
    "popoverForeground": {
      "cssVar": "--popover-foreground",
      "format": "hsl-channel",
      "aliases": [
        { "name": "--color-popover-foreground", "format": "hsl" }
      ],
      "values": {
        "light": "0 0% 3.9%",
        "dark": "0 0% 100%"
      },
      "description": "Text inside popovers and tooltips."
    },
    "primary": {
      "cssVar": "--primary",
      "format": "hsl-channel",
      "aliases": [
        { "name": "--color-primary", "format": "hsl" }
      ],
      "values": {
        "light": "213 85% 56%",
        "dark": "213 85% 56%"
      },
      "description": "Primary interactive color derived from brand blue."
    },
    "primaryForeground": {
      "cssVar": "--primary-foreground",
      "format": "hsl-channel",
      "aliases": [
        { "name": "--color-primary-foreground", "format": "hsl" }
      ],
      "values": {
        "light": "0 0% 100%",
        "dark": "0 0% 100%"
      },
      "description": "Text on primary surfaces."
    },
    "secondary": {
      "cssVar": "--secondary",
      "format": "hsl-channel",
      "aliases": [
        { "name": "--color-secondary", "format": "hsl" }
      ],
      "values": {
        "light": "46 97% 58%",
        "dark": "46 97% 58%"
      },
      "description": "Secondary interactive color derived from brand yellow."
    },
    "secondaryForeground": {
      "cssVar": "--secondary-foreground",
      "format": "hsl-channel",
      "aliases": [
        { "name": "--color-secondary-foreground", "format": "hsl" }
      ],
      "values": {
        "light": "0 0% 12%",
        "dark": "0 0% 100%"
      },
      "description": "Text on secondary surfaces."
    },
    "muted": {
      "cssVar": "--muted",
      "format": "hsl-channel",
      "aliases": [
        { "name": "--color-muted", "format": "hsl" }
      ],
      "values": {
        "light": "0 0% 96.1%",
        "dark": "0 0% 18%"
      },
      "description": "Muted background color for subtle UI."
    },
    "mutedForeground": {
      "cssVar": "--muted-foreground",
      "format": "hsl-channel",
      "aliases": [
        { "name": "--color-muted-foreground", "format": "hsl" }
      ],
      "values": {
        "light": "0 0% 45.1%",
        "dark": "0 0% 67%"
      },
      "description": "Text on muted surfaces."
    },
    "accent": {
      "cssVar": "--accent",
      "format": "hsl-channel",
      "aliases": [
        { "name": "--color-accent", "format": "hsl" }
      ],
      "values": {
        "light": "0 0% 96.1%",
        "dark": "0 0% 18%"
      },
      "description": "Accent and hover states."
    },
    "accentForeground": {
      "cssVar": "--accent-foreground",
      "format": "hsl-channel",
      "aliases": [
        { "name": "--color-accent-foreground", "format": "hsl" }
      ],
      "values": {
        "light": "0 0% 9%",
        "dark": "0 0% 100%"
      },
      "description": "Text on accent surfaces."
    },
    "destructive": {
      "cssVar": "--destructive",
      "format": "hsl-channel",
      "aliases": [
        { "name": "--color-destructive", "format": "hsl" }
      ],
      "values": {
        "light": "0 84.2% 60.2%",
        "dark": "0 100% 71%"
      },
      "description": "Error/destructive background."
    },
    "destructiveForeground": {
      "cssVar": "--destructive-foreground",
      "format": "hsl-channel",
      "aliases": [
        { "name": "--color-destructive-foreground", "format": "hsl" }
      ],
      "values": {
        "light": "0 0% 98%",
        "dark": "0 0% 100%"
      },
      "description": "Text on destructive surfaces."
    },
    "border": {
      "cssVar": "--border",
      "format": "hsl-channel",
      "aliases": [
        { "name": "--color-border", "format": "hsl" }
      ],
      "values": {
        "light": "0 0% 89.8%",
        "dark": "0 0% 20%"
      },
      "description": "Default border color."
    },
    "input": {
      "cssVar": "--input",
      "format": "hsl-channel",
      "aliases": [
        { "name": "--color-input", "format": "hsl" }
      ],
      "values": {
        "light": "0 0% 89.8%",
        "dark": "0 0% 20%"
      },
      "description": "Input border/background color."
    },
    "ring": {
      "cssVar": "--ring",
      "format": "hsl-channel",
      "aliases": [
        { "name": "--color-ring", "format": "hsl" }
      ],
      "values": {
        "light": "213 85% 56%",
        "dark": "213 85% 56%"
      },
      "description": "Focus ring color."
    }
  },
  "dataViz": {
    "charts": {
      "chart1": {
        "cssVar": "--chart-1",
        "format": "hsl-channel",
        "values": {
          "light": "12 76% 61%",
          "dark": "220 70% 50%"
        },
        "description": "Primary chart color."
      },
      "chart2": {
        "cssVar": "--chart-2",
        "format": "hsl-channel",
        "values": {
          "light": "173 58% 39%",
          "dark": "160 60% 45%"
        },
        "description": "Secondary chart color."
      },
      "chart3": {
        "cssVar": "--chart-3",
        "format": "hsl-channel",
        "values": {
          "light": "197 37% 24%",
          "dark": "30 80% 55%"
        },
        "description": "Tertiary chart color."
      },
      "chart4": {
        "cssVar": "--chart-4",
        "format": "hsl-channel",
        "values": {
          "light": "43 74% 66%",
          "dark": "280 65% 60%"
        },
        "description": "Quaternary chart color."
      },
      "chart5": {
        "cssVar": "--chart-5",
        "format": "hsl-channel",
        "values": {
          "light": "27 87% 67%",
          "dark": "340 75% 55%"
        },
        "description": "Quinary chart color."
      }
    }
  },
  "typography": {
    "fonts": [
      {
        "name": "heading",
        "cssVar": "--font-family-heading",
        "family": "National2Condensed",
        "fallback": ["'Arial Black'", "sans-serif"],
        "weight": 700,
        "style": "normal",
        "display": "swap",
        "files": [
          { "path": "/fonts/National-2-Condensed-Bold.ttf", "format": "truetype" }
        ],
        "usage": "All headings (h1-h6), marquee text, strong emphasis."
      },
      {
        "name": "body",
        "cssVar": "--font-family-body",
        "family": "ESKlarheit",
        "fallback": ["'Inter'", "system-ui", "sans-serif"],
        "weight": 400,
        "style": "normal",
        "display": "swap",
        "files": [
          { "path": "/fonts/ESKlarheitGrotesk-Rg.otf", "format": "opentype" }
        ],
        "usage": "Body copy, UI components, long-form text."
      }
    ],
    "sizes": {
      "desktop": {
        "h1": "2.5rem",
        "h2": "2rem",
        "h3": "1.5rem",
        "h4": "1.25rem",
        "h5": "1rem",
        "h6": "0.875rem",
        "body": "1rem",
        "small": "0.875rem",
        "xs": "0.75rem"
      },
      "mobile": {
        "h1": "2rem",
        "h2": "1.5rem",
        "h3": "1.25rem"
      }
    },
    "lineHeight": {
      "heading": "1.2",
      "body": "1.6"
    },
    "letterSpacing": {
      "heading": "-0.02em",
      "body": "0",
      "uppercase": "0.05em"
    }
  },
  "layout": {
    "radius": {
      "mm": {
        "cssVar": "--radius-mm",